{
  "schema_version": "0.3",
  "root": ".pcg-quarantine",
  "updated_at": "2026-07-12T00:00:00Z",
  "items": [{
    "item_id": "example-quarantine-item",
    "original_path": ".pcg-demo/temp/example.tmp",
    "quarantine_path": ".pcg-quarantine/files/example-quarantine-item.bin",
    "sha256": "0000000000000000000000000000000000000000000000000000000000000000",
    "size_bytes": 35,
    "original_mtime": 0,
    "reason": "Synthetic v0.3 showcase",
    "evidence": [{"source": "showcase", "fact": "synthetic L1 example"}],
    "created_at": "2026-07-12T00:00:00Z",
    "restored_at": null,
    "status": "active"
  }]
}
